{"admission_agents":{"baseline":{"argv":["--rolebench-run"],"asset_tree_digest_sha256":"b34e50ce1f976a9adf9b419693794278937915ce2be9f13bf3d0b179c68541b4","config_digest_sha256":"8b4827eb884e4cdc574ce789c1b9b2a49a0348fa867a628017114ec28da1096e","image":"rolebench.local/cancel-async-tasks-baseline@sha256:7abb2e5e76240aef911eddbd503b7de28765f9622181e9fa2c2944a1168614e1","platform":{"architecture":"amd64","os":"linux","variant":null}},"reference":{"argv":["--rolebench-run"],"asset_tree_digest_sha256":"b34e50ce1f976a9adf9b419693794278937915ce2be9f13bf3d0b179c68541b4","config_digest_sha256":"923e40166b1f723e78c7fa09d4ac92e94b6c9841c0c919859241bf5d4a33ca87","image":"rolebench.local/cancel-async-tasks-reference@sha256:c93f881b1c25bcbc7e563905be185ec480609d7d9fcaf594c93a6824ceda782f","platform":{"architecture":"amd64","os":"linux","variant":null}},"tamper":{"argv":["--rolebench-run"],"asset_tree_digest_sha256":"b34e50ce1f976a9adf9b419693794278937915ce2be9f13bf3d0b179c68541b4","config_digest_sha256":"986c52ee39abe2cfb575a12c56d9eccfc19275fa8323b99f88e436e0b4db1342","image":"rolebench.local/cancel-async-tasks-tamper@sha256:e38918f702445c8fe9c5e20be42acd9ec311d736a52a43c92177f4c3578db8d3","platform":{"architecture":"amd64","os":"linux","variant":null}}},"agent":{"argv":["--rolebench-run"],"asset_tree_digest_sha256":"b34e50ce1f976a9adf9b419693794278937915ce2be9f13bf3d0b179c68541b4","config_digest_sha256":"5061dc5f5a645558e6d89a126e4cb5d21d321226016c9601c4b02805745a96c8","image":"rolebench.local/cancel-async-tasks-candidate@sha256:87b27768b73378d8eca2901fb1ee414a0ca7482e2e03af9c79d7dab304c25898","platform":{"architecture":"amd64","os":"linux","variant":null}},"assets":{"public":{"digest_sha256":"b34e50ce1f976a9adf9b419693794278937915ce2be9f13bf3d0b179c68541b4","prompt":{"digest_sha256":"34ed2a20c17889a842facaecc31721042d235bb494527f178cf62b772bbf68d5","kind":"file","path":"contracts/tasks/terminal-bench.cancel-async-tasks/2.1-r6/public/prompt.txt"},"root":"contracts/tasks/terminal-bench.cancel-async-tasks/2.1-r6/public","workspace":{"digest_sha256":"48b7b30d22faa92f5868901c8a2488a907d2f0bc5d91583e133302373a0caf26","kind":"tree","path":"contracts/tasks/terminal-bench.cancel-async-tasks/2.1-r6/public/workspace"}},"verifier_private":{"digest_sha256":"a36d27ac82469e8b97e9fbb5db1ea7101a809452e1d603e7e19656acf7b7cd5a","root":"contracts/tasks/terminal-bench.cancel-async-tasks/2.1-r6/verifier-private","verifier":{"digest_sha256":"42abd00a52c49d17abba2044d7a1cb950d30f6686ed9687663b5def7383a7fc0","kind":"file","path":"contracts/tasks/terminal-bench.cancel-async-tasks/2.1-r6/verifier-private/verifier.py"}}},"authorship":{"author":"rolebench/curator/cancel-async-tasks-v1"},"capability_tags":["autonomous-task-execution","terminal-tool-use","code-editing","repository-navigation","targeted-verification"],"content_digest_sha256":"95c60885c435fec4bc84ed6e6b2ef1672f3e894d59e8c96731fcd59275bf4039","difficulty":"hard","family":{"family_id":"terminal-bench.cancel-async-tasks","variant_id":"2.1-r6-async-concurrency-pool-v1"},"license":{"expression":"Apache-2.0 AND MIT","redistribution":"permitted"},"objective":{"criteria":["Implement async concurrency pool with exact run_tasks signature in run.py.","Enforce max_concurrent task execution bound across active coroutines.","Validate bounds and raise ValueError for non-positive, non-integer, and infinite max_concurrent limits without initiating sentinel callbacks.","Propagate cancellation cleanly and await all active task cleanup handlers before return.","Cancel and await peer tasks on child task exception while preventing queued tasks from starting."],"mode":"executable-task-verifier","observation":{"artifact_kind":"executable","authority":"source-separated-service","runner_output_trust":"untrusted"},"scoring":"binary"},"partition":"anchor","policy":{"digest_sha256":"dc9efcc295d30dfe7e49f3a229d6b0b7e07d9debd0959a2120cf882f30140d70","path":"contracts/scored-worker-policy-v2.json"},"reviews":{"license":{"decision":"approved","evidence_digest_sha256":"b2707e5607c16f5b2c5314b8daec72eb51459b77586cdb00bb03e24fa7f69d1e","evidence_path":"contracts/tasks/terminal-bench.cancel-async-tasks/2.1-r6/reviews/license.json","expression":"Apache-2.0 AND MIT","redistribution":"permitted","reviewed_at":"2026-08-15T10:39:25Z","reviewer":"rolebench/reviewer/license-gate-v1"},"privacy":{"decision":"approved","evidence_digest_sha256":"d6b3e16fc5529f109cd0b7816800f1ac0053fbd24a9796e0a1885cb56a602e96","evidence_path":"contracts/tasks/terminal-bench.cancel-async-tasks/2.1-r6/reviews/privacy.json","reviewed_at":"2026-08-15T10:39:25Z","reviewer":"rolebench/reviewer/privacy-gate-v1"},"split":{"assignment_method":"author-assigned","confidentiality":"public","decision":"approved","evidence_digest_sha256":"39ac9dc52cc96bf9c3b475cb8fbf3fa0e63183476ca7bab779e8a96f51fadc9b","evidence_path":"contracts/tasks/terminal-bench.cancel-async-tasks/2.1-r6/reviews/split.json","family_id":"terminal-bench.cancel-async-tasks","partition":"anchor","reviewed_at":"2026-08-15T10:39:25Z","reviewer":"rolebench/reviewer/role-fit-gate-v1"},"verifier":{"decision":"approved","evidence_digest_sha256":"4d4ec066e9e6bee2eec4953bcd13d25c17f45fe895f943f9f6d855a41796b4c5","evidence_path":"contracts/tasks/terminal-bench.cancel-async-tasks/2.1-r6/reviews/verifier.json","private_tree_digest_sha256":"a36d27ac82469e8b97e9fbb5db1ea7101a809452e1d603e7e19656acf7b7cd5a","reviewed_at":"2026-08-15T13:50:00Z","reviewer":"rolebench/reviewer/verifier-gate-v1","runner_config_digest_sha256":"c76084bf2e16baaf8fca581519b4411220e8e234b5a81e2a0d57da9f0e6655e8","runner_image":"rolebench.local/cancel-async-tasks-runner@sha256:a3ccf45c751c53543052d8de0d17f083d53ae1c9d41600f80dc2f21759f804b4","runner_platform":{"architecture":"amd64","os":"linux","variant":null},"verifier_config_digest_sha256":"5585f16719675a73a0592830db3dd2734d92e1632e8a0dab317317eebdc1b7b5","verifier_image":"rolebench.local/cancel-async-tasks-verifier@sha256:c5740ee5f71abd4c097c12ea7e7a9ec00b8f2e45dbfc3b42071ca9df3f0eddb7","verifier_platform":{"architecture":"amd64","os":"linux","variant":null}}},"role":"task","role_contract":{"contract_id":"role-contract/task/v1","digest_sha256":"dc927f53dafcf63acb5e3609786e6e32a6913d1eadb29b60a7997a606ddca2f6"},"routing_eligible":false,"runner":{"argv":["--rolebench-run"],"asset_tree_digest_sha256":"b34e50ce1f976a9adf9b419693794278937915ce2be9f13bf3d0b179c68541b4","config_digest_sha256":"c76084bf2e16baaf8fca581519b4411220e8e234b5a81e2a0d57da9f0e6655e8","image":"rolebench.local/cancel-async-tasks-runner@sha256:a3ccf45c751c53543052d8de0d17f083d53ae1c9d41600f80dc2f21759f804b4","platform":{"architecture":"amd64","os":"linux","variant":null}},"schema_version":"omp.diagnostic-task/v2","source":{"dataset_digest_sha256":"7d7bdc1cbedad549fc1140404bd4dc45e5fd0ea7c4186773687d177ad3a0699a","digest_sha256":"a3d048d351136e48070696cda8bb79660dfd74db1fea3b6da88559f0332699c1","kind":"terminal-bench","task":"terminal-bench/cancel-async-tasks","version":"terminal-bench/terminal-bench-2-1@6"},"split":{"assignment_method":"author-assigned","author_id":"rolebench/curator/cancel-async-tasks-v1","confidentiality":"public","provenance_digest_sha256":"39ac9dc52cc96bf9c3b475cb8fbf3fa0e63183476ca7bab779e8a96f51fadc9b","reviewer_id":"rolebench/reviewer/role-fit-gate-v1"},"task_id":"terminal-bench.cancel-async-tasks","task_mix":"task-v1","task_version":"2.1-r6","unscored_failures":["infrastructure","provider","runner","verifier"],"verifier":{"argv":["--rolebench-run"],"asset_tree_digest_sha256":"a36d27ac82469e8b97e9fbb5db1ea7101a809452e1d603e7e19656acf7b7cd5a","config_digest_sha256":"5585f16719675a73a0592830db3dd2734d92e1632e8a0dab317317eebdc1b7b5","image":"rolebench.local/cancel-async-tasks-verifier@sha256:c5740ee5f71abd4c097c12ea7e7a9ec00b8f2e45dbfc3b42071ca9df3f0eddb7","platform":{"architecture":"amd64","os":"linux","variant":null}}}
