{
  "admission_agents": {
    "baseline": {
      "argv": [
        "--rolebench-run"
      ],
      "asset_tree_digest_sha256": "4d4fa91778dec5a3cab1a9315e6236b4d1d7080ad00c2c2ac01b7b59f659d2bc",
      "config_digest_sha256": "9f31e2acced6811e5e94027c0b4740db723226f9c02a14a927643ce16b848cd1",
      "image": "rolebench.local/responsive-incident-console-designer-baseline@sha256:29864594af0bf1b9210dcddb243c6cb70ee5b99a4b93eebe54e7f617588e528a",
      "platform": {
        "architecture": "amd64",
        "os": "linux",
        "variant": null
      }
    },
    "reference": {
      "argv": [
        "--rolebench-run"
      ],
      "asset_tree_digest_sha256": "4d4fa91778dec5a3cab1a9315e6236b4d1d7080ad00c2c2ac01b7b59f659d2bc",
      "config_digest_sha256": "4611d7e96b8d43ba00f0375396eb373d9b4f7efc6d112780bd50fd4e6c68b2bb",
      "image": "rolebench.local/responsive-incident-console-designer-reference@sha256:198ed9d13e61941bb8654c7a90d0a1ac2b44e737cf319e2f978a0e89f0cef4c6",
      "platform": {
        "architecture": "amd64",
        "os": "linux",
        "variant": null
      }
    },
    "tamper": {
      "argv": [
        "--rolebench-run"
      ],
      "asset_tree_digest_sha256": "4d4fa91778dec5a3cab1a9315e6236b4d1d7080ad00c2c2ac01b7b59f659d2bc",
      "config_digest_sha256": "a65198b60b7f46866ae25f7e8de3b2d244cf25cd107c26e7a59606298699a335",
      "image": "rolebench.local/responsive-incident-console-designer-tamper@sha256:2d93f1c4a7687614d5f0dca50491b15357ff4f59e45e8dac119a4b345ae4c1bf",
      "platform": {
        "architecture": "amd64",
        "os": "linux",
        "variant": null
      }
    }
  },
  "agent": {
    "argv": [
      "--rolebench-run"
    ],
    "asset_tree_digest_sha256": "4d4fa91778dec5a3cab1a9315e6236b4d1d7080ad00c2c2ac01b7b59f659d2bc",
    "config_digest_sha256": "124c5029f3292326a34b87efafbb6c740742e46a891315d51fe5dcced124872a",
    "image": "rolebench.local/responsive-incident-console-designer-candidate@sha256:dac451641e4afe3de6be1dbbca68640b16c868dcf56160d1458a39207fe89893",
    "platform": {
      "architecture": "amd64",
      "os": "linux",
      "variant": null
    }
  },
  "assets": {
    "public": {
      "digest_sha256": "4d4fa91778dec5a3cab1a9315e6236b4d1d7080ad00c2c2ac01b7b59f659d2bc",
      "prompt": {
        "digest_sha256": "31ebc24cbdb8bff61019af04f7ab1d2d62f191411629331c7dc1195a7c95cfe7",
        "kind": "file",
        "path": "contracts/tasks/omp-native.responsive-incident-console/1.0.0/public/prompt.txt"
      },
      "root": "contracts/tasks/omp-native.responsive-incident-console/1.0.0/public",
      "workspace": {
        "digest_sha256": "49be35a93abcdacc85ede6672f8e6a41381d076b4965434476e6c8cdabe38310",
        "kind": "tree",
        "path": "contracts/tasks/omp-native.responsive-incident-console/1.0.0/public/workspace"
      }
    },
    "verifier_private": {
      "digest_sha256": "2fb47489622660499741f0d07e74d9561c296258d5a034d3ee871ef2511779d5",
      "root": "contracts/tasks/omp-native.responsive-incident-console/1.0.0/verifier-private",
      "verifier": {
        "digest_sha256": "2855c5f9e0c6947fcce4304b521fc859176ebdaa25d37ce9f96fd40e6832b69f",
        "kind": "file",
        "path": "contracts/tasks/omp-native.responsive-incident-console/1.0.0/verifier-private/verifier.py"
      }
    }
  },
  "authorship": {
    "author": "rolebench/curator/responsive-incident-console-designer-v1"
  },
  "capability_tags": [
    "ui-implementation",
    "visual-design-judgment",
    "interaction-design",
    "responsive-layout",
    "accessibility-reasoning"
  ],
  "content_digest_sha256": "4cfec312707c68cdd4bd4c4391142b58c41c3ba7d5e46646bdef932fcf76a8f7",
  "difficulty": "hard",
  "family": {
    "family_id": "omp-native.responsive-incident-console",
    "variant_id": "1.0.0-responsive-incident-console-designer-v1"
  },
  "license": {
    "expression": "MIT",
    "redistribution": "permitted"
  },
  "objective": {
    "criteria": [
      "Implement the requested semantic desktop shell, navigation, service filter, incident cards, and timeline disclosure.",
      "Preserve three-column desktop layout without horizontal overflow at 1280 pixels.",
      "Collapse to a usable mobile layout with labeled navigation and no sidebar at 390 pixels.",
      "Provide visible keyboard focus and operable disclosure interactions.",
      "Meet objective fixed-brief content, semantic structure, responsive layout, interaction, focus, contrast, and screenshot checks in the browser-based runner."
    ],
    "mode": "browser-interaction-check",
    "observation": {
      "artifact_kind": "executable",
      "authority": "source-separated-service",
      "runner_output_trust": "untrusted"
    },
    "scoring": "binary"
  },
  "partition": "anchor",
  "policy": {
    "digest_sha256": "dc9efcc295d30dfe7e49f3a229d6b0b7e07d9debd0959a2120cf882f30140d70",
    "path": "contracts/scored-worker-policy-v2.json"
  },
  "reviews": {
    "license": {
      "decision": "approved",
      "evidence_digest_sha256": "02ed5e28bb7875fbc53667d375fe546c2962290c840819179788a48b8fa10c9a",
      "evidence_path": "contracts/tasks/omp-native.responsive-incident-console/1.0.0/reviews/license.json",
      "expression": "MIT",
      "redistribution": "permitted",
      "reviewed_at": "2026-08-16T01:16:48Z",
      "reviewer": "rolebench/reviewer/license-gate-v1"
    },
    "privacy": {
      "decision": "approved",
      "evidence_digest_sha256": "3b4dd4d806cf8691294313d5e5d8f0554383b394d6c9b822c9f331874d65d042",
      "evidence_path": "contracts/tasks/omp-native.responsive-incident-console/1.0.0/reviews/privacy.json",
      "reviewed_at": "2026-08-16T01:16:48Z",
      "reviewer": "rolebench/reviewer/privacy-gate-v1"
    },
    "split": {
      "assignment_method": "author-assigned",
      "confidentiality": "public",
      "decision": "approved",
      "evidence_digest_sha256": "72e67e0e8602d7cdf26caf523bb2a6ac6e80e941465eca8feb40a2dc1a9470bc",
      "evidence_path": "contracts/tasks/omp-native.responsive-incident-console/1.0.0/reviews/split.json",
      "family_id": "omp-native.responsive-incident-console",
      "partition": "anchor",
      "reviewed_at": "2026-08-15T18:30:00Z",
      "reviewer": "rolebench/reviewer/role-fit-gate-v1"
    },
    "verifier": {
      "decision": "approved",
      "evidence_digest_sha256": "3b5e91a41e35599138f5e6ff0fcf03f609e7e7a2dcf2270435d653685fd8fba6",
      "evidence_path": "contracts/tasks/omp-native.responsive-incident-console/1.0.0/reviews/verifier.json",
      "private_tree_digest_sha256": "2fb47489622660499741f0d07e74d9561c296258d5a034d3ee871ef2511779d5",
      "reviewed_at": "2026-08-16T02:12:34Z",
      "reviewer": "rolebench/reviewer/verifier-gate-v1",
      "runner_config_digest_sha256": "7e54ab7d95ef7dcff156df904de3c3228666775dd3514d8f4fa027c83c0ec35a",
      "runner_image": "rolebench.local/responsive-incident-console-designer-runner@sha256:554a6daef5d2250ad1ea904f26ff9b1e0ab6f0b16761e152d21b9996a34acf72",
      "runner_platform": {
        "architecture": "amd64",
        "os": "linux",
        "variant": null
      },
      "verifier_config_digest_sha256": "af698f07e802822c6b85f47dba4f7e2a221f66968416e9ad98f9c29ef078fc2c",
      "verifier_image": "rolebench.local/responsive-incident-console-designer-verifier@sha256:bf757eac4706e982d3fd2c50b3509b1bd359c494626bddc60e49391823d8b9c9",
      "verifier_platform": {
        "architecture": "amd64",
        "os": "linux",
        "variant": null
      }
    }
  },
  "role": "designer",
  "role_contract": {
    "contract_id": "role-contract/designer/v1",
    "digest_sha256": "d2af35132faead9ec29cd01aa8fb671b309cc92b6894de1c29f84a8b46205bbc"
  },
  "routing_eligible": false,
  "runner": {
    "argv": [
      "--rolebench-run"
    ],
    "asset_tree_digest_sha256": "4d4fa91778dec5a3cab1a9315e6236b4d1d7080ad00c2c2ac01b7b59f659d2bc",
    "config_digest_sha256": "7e54ab7d95ef7dcff156df904de3c3228666775dd3514d8f4fa027c83c0ec35a",
    "image": "rolebench.local/responsive-incident-console-designer-runner@sha256:554a6daef5d2250ad1ea904f26ff9b1e0ab6f0b16761e152d21b9996a34acf72",
    "platform": {
      "architecture": "amd64",
      "os": "linux",
      "variant": null
    }
  },
  "schema_version": "omp.diagnostic-task/v2",
  "source": {
    "digest_sha256": "9cf68a265cb60c8a34a0d7bde0c9ac33456240d7e66b3e903fa3d3a1acbe04ee",
    "kind": "authored",
    "version": "omp-native/responsive-incident-console@1"
  },
  "split": {
    "assignment_method": "author-assigned",
    "author_id": "rolebench/curator/responsive-incident-console-designer-v1",
    "confidentiality": "public",
    "provenance_digest_sha256": "72e67e0e8602d7cdf26caf523bb2a6ac6e80e941465eca8feb40a2dc1a9470bc",
    "reviewer_id": "rolebench/reviewer/role-fit-gate-v1"
  },
  "task_id": "omp-native.responsive-incident-console",
  "task_mix": "designer-v1",
  "task_version": "1.0.0",
  "unscored_failures": [
    "infrastructure",
    "provider",
    "runner",
    "verifier"
  ],
  "verifier": {
    "argv": [
      "--rolebench-run"
    ],
    "asset_tree_digest_sha256": "2fb47489622660499741f0d07e74d9561c296258d5a034d3ee871ef2511779d5",
    "config_digest_sha256": "af698f07e802822c6b85f47dba4f7e2a221f66968416e9ad98f9c29ef078fc2c",
    "image": "rolebench.local/responsive-incident-console-designer-verifier@sha256:bf757eac4706e982d3fd2c50b3509b1bd359c494626bddc60e49391823d8b9c9",
    "platform": {
      "architecture": "amd64",
      "os": "linux",
      "variant": null
    }
  }
}
