{"admission_agents":{"baseline":{"argv":["--rolebench-run"],"asset_tree_digest_sha256":"49e390e4a8f2600501a9e2ff97f93edc9f741fb101cee7e299fe2f4d99ac6315","config_digest_sha256":"29eac34f5e4f927458e41ec41b14ae8331187561e3fc78689010e1f406f5e5e9","image":"rolebench.local/metadata-normalization-tiny-baseline@sha256:9282fd2eb2f27def721f6e9050757295c2c171618fb90b8356edfc056f35d26b","platform":{"architecture":"amd64","os":"linux","variant":null}},"reference":{"argv":["--rolebench-run"],"asset_tree_digest_sha256":"49e390e4a8f2600501a9e2ff97f93edc9f741fb101cee7e299fe2f4d99ac6315","config_digest_sha256":"1fc26e4aa996a3165b2e7224e0486864457445e316703dff5980fd18a1def0c5","image":"rolebench.local/metadata-normalization-tiny-reference@sha256:3a03607d0e9983a8dcd79906ea9502ef07569ac041bc8b5920d9ad4530eff481","platform":{"architecture":"amd64","os":"linux","variant":null}},"tamper":{"argv":["--rolebench-run"],"asset_tree_digest_sha256":"49e390e4a8f2600501a9e2ff97f93edc9f741fb101cee7e299fe2f4d99ac6315","config_digest_sha256":"8986815482739fac049ed3250f9b24a41228553b776bd24528b86cd16a6d056e","image":"rolebench.local/metadata-normalization-tiny-tamper@sha256:6fbfe2c84dc6797044801029a4c1f155571a7e93f168ba8f0083ee96b2f6956e","platform":{"architecture":"amd64","os":"linux","variant":null}}},"agent":{"argv":["--rolebench-run"],"asset_tree_digest_sha256":"49e390e4a8f2600501a9e2ff97f93edc9f741fb101cee7e299fe2f4d99ac6315","config_digest_sha256":"26d89d1b4be7f99e2337a92242e47c2ac8e9b1511388dff49661a05aac7c4327","image":"rolebench.local/metadata-normalization-tiny-candidate@sha256:c5ac63742712c3f5ddf5e7e653480829b493c0ab50050fd204bfc2d6ce54077c","platform":{"architecture":"amd64","os":"linux","variant":null}},"assets":{"public":{"digest_sha256":"49e390e4a8f2600501a9e2ff97f93edc9f741fb101cee7e299fe2f4d99ac6315","prompt":{"digest_sha256":"ab9698988d9b084265302b65e7da8927958c51e0df73d1b836751789aa555de2","kind":"file","path":"contracts/tasks/omp-native.metadata-normalization/1.0.0/public/prompt.txt"},"root":"contracts/tasks/omp-native.metadata-normalization/1.0.0/public","workspace":{"digest_sha256":"49d23ebdcb29148dd9a7edf08e48940249c1d6cb9e626b8a556f6ba8c35b25c6","kind":"tree","path":"contracts/tasks/omp-native.metadata-normalization/1.0.0/public/workspace"}},"verifier_private":{"digest_sha256":"5b3bd527c12e87bf7246d16da916aa370e425543e75416919f62089e0e18c6d5","root":"contracts/tasks/omp-native.metadata-normalization/1.0.0/verifier-private","verifier":{"digest_sha256":"775bc96b9b17215a8e4ce0a9e70b2b15c616689046b57154e104d843f37ca21a","kind":"file","path":"contracts/tasks/omp-native.metadata-normalization/1.0.0/verifier-private/verifier.py"}}},"authorship":{"author":"rolebench/curator/metadata-normalization-tiny-v1"},"capability_tags":["structured-output","exact-format-following","metadata-transformation","classification","minimal-output"],"content_digest_sha256":"9eb688128b75119424c18e5490e08fe0082d885817be423ac62997b61bb30e9f","difficulty":"easy","family":{"family_id":"omp-native.metadata-normalization","variant_id":"1.0.0-metadata-normalization-tiny-v1"},"license":{"expression":"MIT","redistribution":"permitted"},"objective":{"criteria":["Parse the supplied routing header fixture without external state.","Normalize run ID, outcome, role, retryability, and latency bucket exactly as specified.","Lowercase labels, remove duplicates, and preserve first-occurrence order.","Preserve the required key order in the strict output schema.","Return exactly one compact UTF-8 JSON object with no surrounding text."],"mode":"exact-match-check","observation":{"artifact_kind":"executable","authority":"source-separated-service","runner_output_trust":"untrusted"},"scoring":"binary"},"partition":"anchor","policy":{"digest_sha256":"dc9efcc295d30dfe7e49f3a229d6b0b7e07d9debd0959a2120cf882f30140d70","path":"contracts/scored-worker-policy-v2.json"},"reviews":{"license":{"decision":"approved","evidence_digest_sha256":"fd1c38503a08ad2f2fec43d2a0a93321232cb1475bf7468409c0c5a06291d947","evidence_path":"contracts/tasks/omp-native.metadata-normalization/1.0.0/reviews/license.json","expression":"MIT","redistribution":"permitted","reviewed_at":"2026-08-15T18:30:00Z","reviewer":"rolebench/reviewer/license-gate-v1"},"privacy":{"decision":"approved","evidence_digest_sha256":"b425f9fb7e526425954039a39015d4d3cb533ffafcd02e072ab6cb95a6308197","evidence_path":"contracts/tasks/omp-native.metadata-normalization/1.0.0/reviews/privacy.json","reviewed_at":"2026-08-15T18:30:00Z","reviewer":"rolebench/reviewer/privacy-gate-v1"},"split":{"assignment_method":"author-assigned","confidentiality":"public","decision":"approved","evidence_digest_sha256":"c7e945aa52f8d068b4b2d99df375090b74c531a9b9a9b92c0415550634d32171","evidence_path":"contracts/tasks/omp-native.metadata-normalization/1.0.0/reviews/split.json","family_id":"omp-native.metadata-normalization","partition":"anchor","reviewed_at":"2026-08-15T18:30:00Z","reviewer":"rolebench/reviewer/role-fit-gate-v1"},"verifier":{"decision":"approved","evidence_digest_sha256":"7e8592c529bc26dacadff7f4fe803a20375491744793403978eeed3bcb3ad0dd","evidence_path":"contracts/tasks/omp-native.metadata-normalization/1.0.0/reviews/verifier.json","private_tree_digest_sha256":"5b3bd527c12e87bf7246d16da916aa370e425543e75416919f62089e0e18c6d5","reviewed_at":"2026-08-15T20:19:16Z","reviewer":"rolebench/reviewer/verifier-gate-v1","runner_config_digest_sha256":"abe30578a642628936d04a3199e36e0df54a47691fe5d91dfe3b681610abfbda","runner_image":"rolebench.local/metadata-normalization-tiny-runner@sha256:3203ba71cf1d1017e323ff8e0144f7c85a36bf38ba701b9fa840988d7fe74449","runner_platform":{"architecture":"amd64","os":"linux","variant":null},"verifier_config_digest_sha256":"b48ef0078cd378789f93e28895a7cca89f2e994f900bcb9742aa12825b8280e8","verifier_image":"rolebench.local/metadata-normalization-tiny-verifier@sha256:2b9249c40e0f657bee9636b306780407a8ade8c7dad2583f771af06ba8d547b1","verifier_platform":{"architecture":"amd64","os":"linux","variant":null}}},"role":"tiny","role_contract":{"contract_id":"role-contract/tiny/v1","digest_sha256":"1dc4d1f96cb93e7bab22f3334e1310dd3ab8acfeba98466a2c1523b3d6426941"},"routing_eligible":false,"runner":{"argv":["--rolebench-run"],"asset_tree_digest_sha256":"49e390e4a8f2600501a9e2ff97f93edc9f741fb101cee7e299fe2f4d99ac6315","config_digest_sha256":"abe30578a642628936d04a3199e36e0df54a47691fe5d91dfe3b681610abfbda","image":"rolebench.local/metadata-normalization-tiny-runner@sha256:3203ba71cf1d1017e323ff8e0144f7c85a36bf38ba701b9fa840988d7fe74449","platform":{"architecture":"amd64","os":"linux","variant":null}},"schema_version":"omp.diagnostic-task/v2","source":{"digest_sha256":"49e390e4a8f2600501a9e2ff97f93edc9f741fb101cee7e299fe2f4d99ac6315","kind":"authored","version":"omp-native/metadata-normalization@1"},"split":{"assignment_method":"author-assigned","author_id":"rolebench/curator/metadata-normalization-tiny-v1","confidentiality":"public","provenance_digest_sha256":"c7e945aa52f8d068b4b2d99df375090b74c531a9b9a9b92c0415550634d32171","reviewer_id":"rolebench/reviewer/role-fit-gate-v1"},"task_id":"omp-native.metadata-normalization","task_mix":"tiny-v1","task_version":"1.0.0","unscored_failures":["infrastructure","provider","runner","verifier"],"verifier":{"argv":["--rolebench-run"],"asset_tree_digest_sha256":"5b3bd527c12e87bf7246d16da916aa370e425543e75416919f62089e0e18c6d5","config_digest_sha256":"b48ef0078cd378789f93e28895a7cca89f2e994f900bcb9742aa12825b8280e8","image":"rolebench.local/metadata-normalization-tiny-verifier@sha256:2b9249c40e0f657bee9636b306780407a8ade8c7dad2583f771af06ba8d547b1","platform":{"architecture":"amd64","os":"linux","variant":null}}}