{"admission_agents":{"baseline":{"argv":["--rolebench-run"],"asset_tree_digest_sha256":"03ae70eb431bc6992b2fac904de5166e1fc0193f643652ea0e2b8ea1ab17b565","config_digest_sha256":"d735e80bd91a0c2db868edc7fc019b329f6377e2df16446e31ee3dc872d91482","image":"rolebench.local/fix-vulnerability-advisor-baseline@sha256:52a28675c41f1c8a4e2319e744a5a686c420b8183cb13eda4ef911371e12b957","platform":{"architecture":"amd64","os":"linux","variant":null}},"reference":{"argv":["--rolebench-run"],"asset_tree_digest_sha256":"03ae70eb431bc6992b2fac904de5166e1fc0193f643652ea0e2b8ea1ab17b565","config_digest_sha256":"222ad3f1069069593a2252a3068d8e70401df8a535561dac43bc14b684ae2c2c","image":"rolebench.local/fix-vulnerability-advisor-reference@sha256:9b18e4751862c136a0fe391f6f0aa1fb9583d538b2ed5cf58d178741769fd4ff","platform":{"architecture":"amd64","os":"linux","variant":null}},"tamper":{"argv":["--rolebench-run"],"asset_tree_digest_sha256":"03ae70eb431bc6992b2fac904de5166e1fc0193f643652ea0e2b8ea1ab17b565","config_digest_sha256":"38d8dd150329cb03aa728bff6021529b541472f4aedac34e078e37096431534f","image":"rolebench.local/fix-vulnerability-advisor-tamper@sha256:bdbfbac31566db03e3088a3cceb88ead01cf5a914a9b8096f0a052192153e630","platform":{"architecture":"amd64","os":"linux","variant":null}}},"agent":{"argv":["--rolebench-run"],"asset_tree_digest_sha256":"03ae70eb431bc6992b2fac904de5166e1fc0193f643652ea0e2b8ea1ab17b565","config_digest_sha256":"7ab9f1db95ec03386698f52288c0655290d437ef40923d6c46ba372c90e5a435","image":"rolebench.local/fix-vulnerability-advisor-candidate@sha256:67c879111a1b0517618e1197ac52f1f3a0e1507f61180d5c20eecbd5ac1bde6e","platform":{"architecture":"amd64","os":"linux","variant":null}},"assets":{"public":{"digest_sha256":"03ae70eb431bc6992b2fac904de5166e1fc0193f643652ea0e2b8ea1ab17b565","prompt":{"digest_sha256":"afe48e3bf65a79ff52b20b5f33ce53a741a8c7a5dab006cb2983c1444f4f6da6","kind":"file","path":"contracts/tasks/terminal-bench.fix-code-vulnerability/2.1-r6/public/prompt.txt"},"root":"contracts/tasks/terminal-bench.fix-code-vulnerability/2.1-r6/public","workspace":{"digest_sha256":"1c1be3e736dab2312e3fd49c3c3638ae3704c15b4dc39b483dce0432634c3b9f","kind":"tree","path":"contracts/tasks/terminal-bench.fix-code-vulnerability/2.1-r6/public/workspace"}},"verifier_private":{"digest_sha256":"3f28af25cb74345d98e369e1da789eb231612ce0b10c52e9851ce80aef129695","root":"contracts/tasks/terminal-bench.fix-code-vulnerability/2.1-r6/verifier-private","verifier":{"digest_sha256":"57d953c86099af4c1a2055e2055db57b50da5bf96b71d40bf6da39f7301662d3","kind":"file","path":"contracts/tasks/terminal-bench.fix-code-vulnerability/2.1-r6/verifier-private/verifier.py"}}},"authorship":{"author":"rolebench/curator/fix-code-vulnerability-v1"},"capability_tags":["code-review","defect-detection","risk-analysis","evidence-citation","false-positive-control"],"content_digest_sha256":"c68f690354105164f88442811b449d1663553aeb600ac577bd97cf28e8ac2f77","difficulty":"medium","family":{"family_id":"terminal-bench.fix-code-vulnerability","variant_id":"2.1-r6-cwe93-crlf-header-injection-v1"},"license":{"expression":"Apache-2.0 AND MIT","redistribution":"permitted"},"objective":{"criteria":["Perform an independent security code review of the web framework request and response processing codebase.","Isolate the seeded vulnerability: missing control character neutralization in HTTP header normalization functions.","Correctly classify the defect under CWE-93 (CRLF Injection) / HTTP Header Injection with severity and impact analysis.","Cite concrete evidence from source code locations where unvalidated control bytes are accepted.","Synthesize a safe, bounded ValueError remediation and prohibit SILENT_WHITESPACE_STRIPPING, URL_ENCODING, EXCEPTION_SUPPRESSION, and DISABLE_HEADER_MODIFICATIONS.","Audit candidate vulnerability areas and explicitly reject unsupported false-positive alerts."],"mode":"finding-evidence-review","observation":{"artifact_kind":"data-only","authority":"host-process","runner_output_trust":"untrusted"},"scoring":"binary"},"partition":"anchor","policy":{"digest_sha256":"dc9efcc295d30dfe7e49f3a229d6b0b7e07d9debd0959a2120cf882f30140d70","path":"contracts/scored-worker-policy-v2.json"},"reviews":{"license":{"decision":"approved","evidence_digest_sha256":"57baea5fa8b9a41734e46d0914c31c332f96b6eab7d126e809c84daff7b501b4","evidence_path":"contracts/tasks/terminal-bench.fix-code-vulnerability/2.1-r6/reviews/license.json","expression":"Apache-2.0 AND MIT","redistribution":"permitted","reviewed_at":"2026-08-15T10:39:25Z","reviewer":"rolebench/reviewer/license-gate-v1"},"privacy":{"decision":"approved","evidence_digest_sha256":"00d9a19eca375516a02935b32d716fb0616bf97c1df9b36c0f73314f5778b942","evidence_path":"contracts/tasks/terminal-bench.fix-code-vulnerability/2.1-r6/reviews/privacy.json","reviewed_at":"2026-08-15T10:39:25Z","reviewer":"rolebench/reviewer/privacy-gate-v1"},"split":{"assignment_method":"author-assigned","confidentiality":"public","decision":"approved","evidence_digest_sha256":"10e807d495c3808f6539b0a9e117772f9d79d02143d7e349f200a810a37292a7","evidence_path":"contracts/tasks/terminal-bench.fix-code-vulnerability/2.1-r6/reviews/split.json","family_id":"terminal-bench.fix-code-vulnerability","partition":"anchor","reviewed_at":"2026-08-15T10:39:25Z","reviewer":"rolebench/reviewer/role-fit-gate-v1"},"verifier":{"decision":"approved","evidence_digest_sha256":"e8f72cb83941edd6183c62a4de213e08d514b9d75fddeebbe0c9bc843a900bcc","evidence_path":"contracts/tasks/terminal-bench.fix-code-vulnerability/2.1-r6/reviews/verifier.json","private_tree_digest_sha256":"3f28af25cb74345d98e369e1da789eb231612ce0b10c52e9851ce80aef129695","reviewed_at":"2026-08-15T10:44:53Z","reviewer":"rolebench/reviewer/verifier-gate-v1","runner_config_digest_sha256":"17adb58eb23b96483bfc8238174f24c1c2a61f3aa835ff3c893876b12340d240","runner_image":"rolebench.local/fix-vulnerability-advisor-runner@sha256:7b3f4864387b3eff78838f4e70090acef97d4696bd69563ee6799dc6d71f1757","runner_platform":{"architecture":"amd64","os":"linux","variant":null},"verifier_config_digest_sha256":"ef27ed85e3c122a35d27b5c5e2d3b774f96622450d5bdff4a98b1f22978b595b","verifier_image":"rolebench.local/fix-vulnerability-advisor-verifier@sha256:2a8822a0ff7c69c519aab73a3e86e2856adc5ccb0ba50cc62a5268258d4cd7cb","verifier_platform":{"architecture":"amd64","os":"linux","variant":null}}},"role":"advisor","role_contract":{"contract_id":"role-contract/advisor/v1","digest_sha256":"8bc6e30d3a060a23124b9e8b0825f1f2d387d6d229a00af69b74fa0ffc2c66d8"},"routing_eligible":false,"runner":{"argv":["--rolebench-run"],"asset_tree_digest_sha256":"03ae70eb431bc6992b2fac904de5166e1fc0193f643652ea0e2b8ea1ab17b565","config_digest_sha256":"17adb58eb23b96483bfc8238174f24c1c2a61f3aa835ff3c893876b12340d240","image":"rolebench.local/fix-vulnerability-advisor-runner@sha256:7b3f4864387b3eff78838f4e70090acef97d4696bd69563ee6799dc6d71f1757","platform":{"architecture":"amd64","os":"linux","variant":null}},"schema_version":"omp.diagnostic-task/v2","source":{"dataset_digest_sha256":"7d7bdc1cbedad549fc1140404bd4dc45e5fd0ea7c4186773687d177ad3a0699a","digest_sha256":"d31348aa16b533a15f013420e4d9726dc529e6086adc7d6d48067d22cc18fe71","kind":"terminal-bench","task":"terminal-bench/fix-code-vulnerability","version":"terminal-bench/terminal-bench-2-1@6"},"split":{"assignment_method":"author-assigned","author_id":"rolebench/curator/fix-code-vulnerability-v1","confidentiality":"public","provenance_digest_sha256":"10e807d495c3808f6539b0a9e117772f9d79d02143d7e349f200a810a37292a7","reviewer_id":"rolebench/reviewer/role-fit-gate-v1"},"task_id":"terminal-bench.fix-code-vulnerability","task_mix":"advisor-v1","task_version":"2.1-r6","unscored_failures":["infrastructure","provider","runner","verifier"],"verifier":{"argv":["--rolebench-run"],"asset_tree_digest_sha256":"3f28af25cb74345d98e369e1da789eb231612ce0b10c52e9851ce80aef129695","config_digest_sha256":"ef27ed85e3c122a35d27b5c5e2d3b774f96622450d5bdff4a98b1f22978b595b","image":"rolebench.local/fix-vulnerability-advisor-verifier@sha256:2a8822a0ff7c69c519aab73a3e86e2856adc5ccb0ba50cc62a5268258d4cd7cb","platform":{"architecture":"amd64","os":"linux","variant":null}}}
